<?xml version="1.0" encoding="utf-8"?>
<program xmlns:xsi="http://www.w3.org/2001/XMLSchema-instance" xsi:schemaLocation=". program.xsd">
    <description>
        <textures>
            <texture id="colorMap" sampler="LinearSampler" layout="0" semantic="color" default="default_c.png"/>
            <texture id="normalMap" sampler="LinearSampler" layout="1" semantic="normal" default="default_n.png"/>
        </textures>
        <parameters/>
    </description>
    <sets>
        <set id="stone"/>
        <set id="marble"/>
        <set id="metal"/>
        <set id="fabric"/>
    </sets>
</program>
